zone_id,zone_type,zone_geometry,severity,description,zone_reason,regulatory_authority,required_permits
cod_spawn_01,critical_habitat,"POLYGON((-59.5 45.2, -58.0 45.2, -58.0 46.5, -59.5 46.5, -59.5 45.2))",critical,"Critical cod spawning area - Grand Banks region","Cod spawn during March-June, turbine noise disrupts reproduction","Department of Fisheries and Oceans Canada","Fisheries Act Section 35 authorization required"
marine_protected_01,protected_area,"POLYGON((-60.2 44.0, -59.5 44.0, -59.5 44.8, -60.2 44.8, -60.2 44.0))",critical,"Sable Island Marine Protected Area","Federal protection, no industrial development","Parks Canada Agency","Marine Protected Areas Act - development prohibited"
fishing_ground_01,commercial_fishing,"POLYGON((-57.5 45.5, -56.8 45.5, -56.8 46.2, -57.5 46.2, -57.5 45.5))",medium,"Traditional cod fishing grounds","Active fishing vessels, gear conflicts with turbines","Department of Fisheries and Oceans Canada","Fisheries conflict assessment required"
shallow_water_01,depth_restriction,"POLYGON((-56.2 43.2, -55.5 43.2, -55.5 43.8, -56.2 43.8, -56.2 43.2))",medium,"Shallow water area <20m depth","Insufficient depth for offshore wind turbines","Natural Resources Canada","Seabed assessment required"
cod_juvenile_01,critical_habitat,"POLYGON((-58.8 44.8, -57.5 44.8, -57.5 45.8, -58.8 45.8, -58.8 44.8))",critical,"Juvenile cod nursery area","Essential fish habitat protection zone","Department of Fisheries and Oceans Canada","Species at Risk Act consultation required"
approved_zone_01,development_area,"POLYGON((-56.0 43.0, -55.0 43.0, -55.0 44.0, -56.0 44.0, -56.0 43.0))",low,"Pre-approved offshore wind development zone","Designated renewable energy development area","Nova Scotia Department of Energy","Standard environmental assessment applies"
military_zone_01,restricted_area,"POLYGON((-60.8 43.8, -60.0 43.8, -60.0 44.5, -60.8 44.5, -60.8 43.8))",critical,"Military training area","Naval exercises and weapons testing","Department of National Defence","Military clearance required - development restricted"
shipping_lane_01,navigation,"POLYGON((-61.8 43.5, -55.2 46.8, -55.2 46.6, -61.6 43.3, -61.8 43.5))",high,"Major shipping lane Halifax to Europe","High vessel traffic, collision risk with turbines","Transport Canada","Navigable Waters Protection Act permit required"
cable_corridor_01,infrastructure,"LINESTRING(-61.0 44.5, -58.5 45.8, -55.2 46.3)",high,"Undersea cable corridor","Existing telecommunications infrastructure","Canadian Radio-television and Telecommunications Commission","Infrastructure conflict assessment required"